ID;ID progetto;REQUISITO (testo);Classe dei requisiti;CATEGORIA;PAROLA
R671;22;All data entry forms for the application should match their Microsoft Excel hardcopy counterparts as closely as possible. Hardcopies of these forms were provided to the design team during the second requirements interview.;O;adv;closely
R676;24;The application should be easy to extend. The code should be written in a way that it favors implementation of new functions.;MN;adv;in a way
R679;25;The system shall show a tabbed display (or equivalent functionality) with the campus map on one tab and info on the most recently announced building on the other.;LF;adv;most recently
R681;25;The campus map shall provide visual clues regarding what areas have prepared audio and therefore may be selected.;LF;adv;therefore
R687;27;The system shall be capable of restoring itself to its previous state in the event of failure (e.g. a system crash or power loss).;FT;adv;e.g.
R688;27;The system shall be able to display a menu at all times to facilitate manual order taking should the need arise.;LF;adv;at all
R691;27;A waiter password used for tablet login must have a bit-strength of at least 64 bits.;SE;adv;a bit
R691;27;A waiter password used for tablet login must have a bit-strength of at least 64 bits.;SE;adv;at least
R694;27;A waiter that attempts to log into a second tablet while already logged into another tablet shall be rejected and notified through both tablets.;SE;adv;already
R698;28;The system will fully function in major browsers.;PO;adv;fully
R699;28;The system will support mobile users in some way.;PO;adv;in some way
R700;29;Responses to view information shall take no longer than 5 seconds to appear on the screen.;PE;adv;no longer
R716;30;Be intuitive even to first time users;LF;adv;even
R726;32;It must be able to download the most recent medical record.;F;adv;most
R727;32;It must store the most recent copy of information in its application data folder.;F;adv;most
R741;32;Full data backups must be created daily.;SE;adv;daily
R756;34;The system use SSL (secured socket layer) in all transactions that include any confidential customer information.;SE;adv;in all
R757;34;The system must automatically log out all customers after a period of inactivity.;SE;adv;automatically
R762;34;The reliability of the overall program depends on the reliability of the separate components. The main pillar of reliability of the system is the backup of the database which is continuously maintained and updated to reflect the most recent changes.;FT;adv;continuously
R762;34;The reliability of the overall program depends on the reliability of the separate components. The main pillar of reliability of the system is the backup of the database which is continuously maintained and updated to reflect the most recent changes.;FT;adv;most
R764;35;The logo and the current basic design of registration system should be displayed. The system should be attractive according to the clients. The design and the color should make users feel comfortable when using the system instead of flashing useless colors on the screen. The design should also reflect the seriousness of the environment.;LF;adv;instead
R766;35;The product is Web based therefore it will be used in any environment that allows Web access.;PO;adv;therefore
R767;35;For the system to successfully operate the registration system should be integrated with other IT services and the portal.;O;adv;successfully
R768;35;The system should need to be entirely self-supporting since the users would be using it only to register courses.;US;adv;entirely
R772;36;The Operational Interface shall have a Mean Time Between Failures of no less than 7 days.;FT;adv;less than
R774;36;The software system needs a robust security mechanism in place so that unauthorized users are not allowed access to parts of the system.;SE;adv;in place
R777;36;All source code shall adhere to an agreed upon and well-defined set of coding standards for each development language used.;MN;adv;well
R786;38;Normal users can just read information but they cannot edit or modify anything except their personal and some other information.;SE;adv;just
R801;38;Responsible for properly allocating the selected product according to the customer’s choice and delivering product to the customer.;F;adv;properly
R825;42;The font will be larger enough for easy reading.;F;adv;enough
R826;42;Icons will clearly illustrate the feature it represents.;F;adv;clearly
R827;42;Basic Patient information is showed first.;F;adv;first
R829;42;Each entry is shown in full.;F;adv;in full
R830;42;The text and time/date of a note that has been entered is displayed starting with most recent.;F;adv;most
R832;42;A description and time/date of each prescription that has been ordered or given is displayed starting with most recent.;F;adv;most
R834;43;All login attempts shall be done so in a secure manner.;SE;adv;so
R854;45;The system shall allow the user to modify the date preference set of an already submitted meeting response.;F;adv;already
R855;45; The system shall allow the user to modify the location preference set of an already submitted meeting response.;F;adv;already
R856;45;The system shall allow the user to modify the equipment requirement set of an already submitted meeting response.;F;adv;already
R857;45;The system shall allow the user to modify the date exclusion set of an already submitted meeting response.;F;adv;already
R868;45;The web application shall add no more than 5 seconds of perceivable overhead time to any necessary web and database transaction time.;PE;adv;no more
R874;45;The system shall be compatible with IIS6.0 and above or  Apache 2.0 and above.;PO;adv;above
R896;46;The system shall display the most frequently searched items by the user in the profile.;F;adv;most
R943;46;The system shall use secure sockets in all transactions that include any confidential customer information.;SE;adv;in all
R944;46;The system shall automatically log out all customers after a period of inactivity.;SE;adv;automatically
R948;46;The customer’s web browser shall never display a customer’s password.  It shall always be echoed with special characters representing typed characters.;SE;adv;never
R948;46;The customer’s web browser shall never display a customer’s password.  It shall always be echoed with special characters representing typed characters.;SE;adv;always
R949;46;The customer’s web browser shall never display a customer’s credit card number after retrieving from the database.  It shall always be shown with just the last 4 digits of the credit card number.;SE;adv;never
R949;46;The customer’s web browser shall never display a customer’s credit card number after retrieving from the database.  It shall always be shown with just the last 4 digits of the credit card number.;SE;adv;always
R949;46;The customer’s web browser shall never display a customer’s credit card number after retrieving from the database.  It shall always be shown with just the last 4 digits of the credit card number.;SE;adv;just
R950;46;The system’s back-end servers shall never display a customer’s password.  The customer’s password may be reset but never shown.;SE;adv;never
R955;48;Any page of the application should not take more than 6 seconds to load on a DSL broadband connection.;PE;adv;more than
R959;48;The MTBF (if any) should not be less than 2 months.;A;adv;less than
R961;48;The user interface of the system should be very user friendly. ;US;adv;very
R962;48;It should not take more than 120 seconds for a new user to register for an account.;US;adv;more than
R963;48;It should not take more than 90 seconds for a registered user to place an order.;US;adv;more than
R964;48;The system should be easy enough to maintain that someone else could do it with a manual and a few hours training.;MN;adv;enough
R964;48;The system should be easy enough to maintain that someone else could do it with a manual and a few hours training.;MN;adv;else
R966;49;Registered User must be able to maintain his/her session information for at least 60 minutes of inactive session before the system prompts him to log out of the system. The registered user must be provided with all the options of the E-store regardless of the time when he/she logs in.;F;adv;at least
R968;49;The system shall support up to 10000 simultaneous users against the central database at any given time and up to 5000 simultaneous users against the local servers at any one time. The performance of the website must be optimal incase of huge loads and hence appropriate load balancing must be done to achieve this. There can be any number of mirror servers readily available in case of huge loads without the user getting any delay.;PE;adv;one time
R968;49;The system shall support up to 10000 simultaneous users against the central database at any given time and up to 5000 simultaneous users against the local servers at any one time. The performance of the website must be optimal incase of huge loads and hence appropriate load balancing must be done to achieve this. There can be any number of mirror servers readily available in case of huge loads without the user getting any delay.;PE;adv;hence
R968;49;The system shall support up to 10000 simultaneous users against the central database at any given time and up to 5000 simultaneous users against the local servers at any one time. The performance of the website must be optimal incase of huge loads and hence appropriate load balancing must be done to achieve this. There can be any number of mirror servers readily available in case of huge loads without the user getting any delay.;PE;adv;readily
