ID;ID progetto;REQUISITO (testo);Classe dei requisiti;CATEGORIA;PAROLA
R410;8;The product shall be expected to operate within the maximum maintenance budget for a minimum of 2 years.;MN;vague;maximum
R413;8;We must be able to interface with the following browsers: IE 5.X  6.0  Netscape 6.x  7.x  8.x and Firefox 1.0.;O;vague;able to
R419;8;Izogn Administrator must be able to update the category listings on the website within 2 minutes.;PE;vague;able to
R420;8;Izogn Administrator must be able to add new products to the website within 2 minutes.;PE;vague;able to
R422;8;The website will provide a help section with answers and solutions to common problems.;US;vague;common
R424;8;The product shall be able to be installed in the specified environment within 1 working day.;O;vague;able to
R425;8;Only registered customers can purchase streaming movies.;SE;vague;Only
R426;8;A customer can only stream a movie if they purchased it  and are within the 2 day viewing period.;SE;vague;only
R427;8;Only authorized personnel can access customer records in the database.;SE;vague;Only
R428;8;Only administrators can activate a pre-paid card.;SE;vague;Only
R429;8;Only authorized personnel can access sales information.;SE;vague;Only
R435;8;The system shall reveal private information only in compliance with the organization\92s information policy.;SE;vague;only
R436;8;All customer information will be stored on a secure database  accessible only to authorized personnel.;SE;vague;secure
R436;8;All customer information will be stored on a secure database  accessible only to authorized personnel.;SE;vague;only
R441;8;The website should appeal to all Africans  not only Nigerians.;LF;vague;not only
R449;8;shall be able to stream purchased movie via Windows Media Player  for up to 2 days aftere purchase date.;F;vague;able to
R459;8;Movies can only be streamed if the customer has purchased a movie  and is within the 2-day time period to stream the movie.;F;vague;only
R460;8;Website must be able to support free trial periods with various parameters set by the Izogn Manager.;F;vague;able to
R460;8;Website must be able to support free trial periods with various parameters set by the Izogn Manager.;F;vague;various
R469;9;The lead washing process will operate within the established physical web service structure.;O;vague;physical
R470;9;The washing process must use a non binding  neutral data format  such as xml  when receiving and processing lead data.;O;vague;neutral
R481;9;The leads washing functionality will compile both contact and academic scoring information for a total score.;F;vague;both
R491;10;The product shall display each type of ship in a grid using an image of the specific type of ship.;LF;vague;specific
R497;10;The product shall able to handle a large number of games simultaneously.;PE;vague;able to
R498;10;The response time shall be fast enough to maintain the flow of the game.  The response time shall be no more than 2 seconds for 95% of responses and no more than 4% for the remaining responses.;PE;vague;fast
R500;10;The product shall be intuitive and self-explanatory.  Nine out ten users shall be able to successfully complete a game with no training.;US;vague;able to
R503;10;The response time shall be fast enough to maintain the flow of the game. The response time shall be no more than 2 seconds for 95% of responses and no more than 4% for the remaining responses.;PE;vague;fast
R514;10;Once a game is initiated  the product shall allow each player to position their 5 ships on their respective defensive grids.;F;vague;respective
R519;10;When both players have positioned their 5 ships on their defensive grids  the product shall define the status of each player for the first turn.;F;vague;both
R542;11;The system shall be easy to use by callers and supervisors. Callers and supervisors must be able to accomplish any system task within 2 minutes.;US;vague;able to
R542;11;The system shall be easy to use by callers and supervisors. Callers and supervisors must be able to accomplish any system task within 2 minutes.;US;vague;easy
R543;11;The system shall be easy to learn by callers and supervisors. Callers and supervisors shall learn how to use the system within 10 minutes.;US;vague;easy
R546;11;On a 112k connection or faster  the system response time for all operations must be no more than 3 seconds 90% of the time.;PE;vague;faster
R550;11;The product shall ensure that only supervisors can advertise empty time slots.The product must ensure that supervisors are allowed to access advertise empty time slots.;SE;vague;only
R551;11;The product shall ensure that only supervisors can enter a caller\92s schedule.The product must ensure that supervisors are allowed to access advertise empty time slots.;SE;vague;only
R552;11;The product shall ensure that only supervisors can view schedule of all callers.The product must ensure that supervisors are allowed to access advertise empty time slots.;SE;vague;only
R553;11;The interface shall have a simple look. In the interface and usability survey  90% of beta testers must report that the interface is adequately simple.;LF;vague;simple
R555;12;The product shall provide GUI based Monitoring Services.System Administrators shall monitor message exchanges will predict and determine problems and will also provide internal and external support.;LF;vague;also
R557;12;The product shall provide Monitoring Services.The product shall be easy for System Administrators and DBAs to use after two weeks of usage.;US;vague;easy
R561;12;The product shall provide Multi-threading and Load Balancing.The product shall provide multi-threading technology as well as load balancing to overcome data load spikes and traffic.;PE;vague;as well as
R562;12;The product shall process messages within 2 seconds.The product shall have a maximum message processing time of 2 seconds;PE;vague;maximum
R564;12;The product shall provide Dynamic Change Support and Transparent resource addition.The product shall support Transparent Resource addition and Dynamic Change support to provide scalability and avoid service interruptions of more than 1 day.;PE;vague;Transparent
R566;12;The product shall be robust.The product shall have fault avoidance based on standards adoption.;FT;vague;robust
R567;12;The product shall be robust with fault tolerance.The product shall have fault tolerance by using recovery technique compensatory transaction and routing around failures.;FT;vague;robust
R568;12;The product shall be able to process all transactions.The product shall process minimum of 1 million transactions per year.;SC;vague;able to
R571;12;The product shall continue to operate during upgrade  change or new resource addition.The product shall be able to continue to operate with no interruption in service due to new resource additions.;MN;vague;able to
R580;13;The interface must summarize the data in a fashion that\92s appealing to CCR management. Every report type must have at least one high level summary shown in the results dashboard/interface;LF;vague;high level
R581;13;The system must use a point and click interface. 100% of all selection and navigation functionality must be able to be activated/selected by either a mouse or a keyboard;US;vague;able to
R582;13;The interface shall be easy to use. 90% of users should be able to successfully use the system to generate a report on their first use. The interface should adhere to IBM usability standards.;US;vague;able to
R582;13;The interface shall be easy to use. 90% of users should be able to successfully use the system to generate a report on their first use. The interface should adhere to IBM usability standards.;US;vague;easy
R583;13;Reports must be easy to generate. Reports must be generated within one button click and exported within one button click (after selecting the report);US;vague;easy
R584;13;A user shall be able to use the system without instruction after a short amount of time. After one use a user should understand and remember 90% of the system usage and navigation.;US;vague;able to
R591;13;The Brio portion of the WCS system must be able to export files in spreadsheet form (Microsoft Excel and Lotus 1-2-3 formats).  Brio will provide buttons in the user interface that produce/export reports in .xls or .123 file formats.;O;vague;able to
R594;13;The system shall only be accessed by authorized Corporate Community Grants (CCR) employees. Users must be authenticated using their IBM intranet user name and password.;SE;vague;only
R597;14;The Commissioner will be the only authorized user per league to adjust league settings.;SE;vague;only
R601;14;A new user shall be able to navigate through the league and team pages within 30 seconds of reaching the start-up page.;US;vague;able to
R602;14;Users shall be able to reach the \91add\92  \91drop\92  and \91trade player\92 pages with one click from the team owner\92s page.;US;vague;able to
R603;14;Users shall be able to view at least 25 NFL player statistics and points on each page.;US;vague;able to
R605;14;The application shall be able to complete every user transaction within one fourth of a second of receiving the request over the network.;PE;vague;able to
R613;15;98% of the user workstations shall meet the minimum hardware requirements prior to implementation. Minimum Hard Disk Space:  400MB.;O;vague;minimum
R614;15;98% of the user workstations shall meet the minimum software requirements prior to implementation: Microsoft Internet Explorer 5.0. Microsoft .NET Framework 1.1. Microsoft Internet Explorer Web Controls;O;vague;minimum
R615;15;The RFS system should be able to easily interface with the BDW environment  in order to load the data. \95	7 data files shall be received from the BDW and loaded into the RFS system within 3 hours one day prior to the start of budgeting process  every year. The data will be as of October month-end. 	Test files (7) shall be loaded up to 5 times throughout the year  from the BDW.;O;vague;able to
R615;15;The RFS system should be able to easily interface with the BDW environment  in order to load the data. \95	7 data files shall be received from the BDW and loaded into the RFS system within 3 hours one day prior to the start of budgeting process  every year. The data will be as of October month-end. 	Test files (7) shall be loaded up to 5 times throughout the year  from the BDW.;O;vague;easily
R618;15;Only authorized user shall access the RFS system. ONLY users that exist in the UAS system  with the RFS system assigned to their role(s)  shall access the RFS system and use it.;SE;vague;exist in
R618;15;Only authorized user shall access the RFS system. ONLY users that exist in the UAS system  with the RFS system assigned to their role(s)  shall access the RFS system and use it.;SE;vague;Only
R618;15;Only authorized user shall access the RFS system. ONLY users that exist in the UAS system  with the RFS system assigned to their role(s)  shall access the RFS system and use it.;SE;vague;ONLY
R622;15;The users should be able to easily use the system to successfully complete their budgets  within the stipulated time for completion. With a week of training prior to product implementation  98% of the users shall complete their budgets within the stipulated time.;US;vague;able to
R622;15;The users should be able to easily use the system to successfully complete their budgets  within the stipulated time for completion. With a week of training prior to product implementation  98% of the users shall complete their budgets within the stipulated time.;US;vague;easily
R623;15;The product interface should be fast. The response time of the product interface should not exceed 2 seconds 90% of the time. For 10% of the time  the response time should not be more than 10 seconds.not be more than 10 seconds.;PE;vague;fast
R628;16;The system shall support the ability to perform a send only operation.;F;vague;only
R629;16;The system shall support the ability to perform a receive only operation.;F;vague;only
R641;17;The system shall be able to issue a specific amount of money to the user.;F;vague;able to
R641;17;The system shall be able to issue a specific amount of money to the user.;F;vague;specific
R642;18;The meeting scheduler system shall be able to select a participant as an important participant.;F;vague;able to
R648;18;The meeting scheduler system may be able to include an agenda for a meeting proposal.;F;vague;able to
R650;18;The meeting scheduler system may be able to include a list of required equipment for a meeting proposal.;F;vague;able to
R653;19;The system must be easy to use by both managers and chefs such that they do not need to read an extensive amount of manuals.;US;vague;easy
R653;19;The system must be easy to use by both managers and chefs such that they do not need to read an extensive amount of manuals.;US;vague;both
R654;19;The system must be quickly accessible by both managers and chefs.;US;vague;quickly
R654;19;The system must be quickly accessible by both managers and chefs.;US;vague;both
R655;19;The system must be intuitive and simple in the way it displays all relevant data and relationships.;US;vague;simple
R655;19;The system must be intuitive and simple in the way it displays all relevant data and relationships.;US;vague;relevant
R656;19;The menus of the system must be easily navigable by the users with buttons that are easy to understand.;US;vague;easily
R656;19;The menus of the system must be easily navigable by the users with buttons that are easy to understand.;US;vague;easy
R666;20;The system shall permit only cafeteria staff members who are on the list of authorized Menu Managers to create or edit menus.;F;vague;only
R667;20;Only users who have been authorized for home access to the corporate Intranet may use the COS from non-company locations.;SE;vague;Only
R668;21;Programmers and application developers will have access to source code to address bugs or system enhancements as deemed necessary. Network Administrator and DBA support is also required to maintain a 24x7 system uptime.;A;vague;necessary
R668;21;Programmers and application developers will have access to source code to address bugs or system enhancements as deemed necessary. Network Administrator and DBA support is also required to maintain a 24x7 system uptime.;A;vague;also
R669;21;System security and access levels are provided in the online system. There are varying levels of system access and functional authority. Each student’s access is limited to his/her own registration records. Only authorized system administrator(s) has access to all student registration records.;SE;vague;varying
R669;21;System security and access levels are provided in the online system. There are varying levels of system access and functional authority. Each student’s access is limited to his/her own registration records. Only authorized system administrator(s) has access to all student registration records.;SE;vague;Only
R672;23;95% of users will not need to read the user manual to be able to use the application.;US;vague;able to
R676;24;The application should be easy to extend. The code should be written in a way that it favors implementation of new functions.;MN;vague;easy
R687;27;The system shall be capable of restoring itself to its previous state in the event of failure (e.g. a system crash or power loss).;FT;vague;capable of
R688;27;The system shall be able to display a menu at all times to facilitate manual order taking should the need arise.;LF;vague;able to
R690;27;The system shall flag tablets that fail to send timely keep-alive messages as non-operational and disassociate the assigned waiter from the tablet.;FT;vague;timely
R693;27;A waiter shall only be able to log into one tablet at any given instance of time.;SE;vague;able to
R693;27;A waiter shall only be able to log into one tablet at any given instance of time.;SE;vague;only
R694;27;A waiter that attempts to log into a second tablet while already logged into another tablet shall be rejected and notified through both tablets.;SE;vague;both
R702;29;System will use secured database.;SE;vague;secured
R703;29;Unauthorised users can only read data without modifying anything.;SE;vague;only
R708;30;Enable a registered user to view his profile. Additional information viz. questions asked by him and answers posted by him are also displayed.;F;vague;Additional
R708;30;Enable a registered user to view his profile. Additional information viz. questions asked by him and answers posted by him are also displayed.;F;vague;also
R715;30;Information transmission should be securely transmitted to server without any changes in information.;SE;vague;securely
R723;31;Detailed documentation of the code and SRS will enable easy maintenance of the Flea Market.;MN;vague;easy
R726;32;It must be able to download the most recent medical record.;F;vague;able to
R726;32;It must be able to download the most recent medical record.;F;vague;recent
R727;32;It must store the most recent copy of information in its application data folder.;F;vague;recent
R728;32;It must only update the parts that have changed when connecting to the server.;O;vague;only
R729;32;It must be able to change and update information on the server.;O;vague;able to
R733;32;The user must be able to set an option to hide information based on who has tagged it.;F;vague;able to
R734;32;The user must be able to add photos from his/her photo library to his/her medical record.;F;vague;able to
R742;32;A user must be logged on to be able to view or edit any medical information.;F;vague;able to
R743;32;Each account must securely store all of its data.;SE;vague;securely
R759;34;The system’s back-end servers shall only be accessible to authenticated administrators.;SE;vague;only
R762;34;The reliability of the overall program depends on the reliability of the separate components. The main pillar of reliability of the system is the backup of the database which is continuously maintained and updated to reflect the most recent changes.;FT;vague;recent
R764;35;The logo and the current basic design of registration system should be displayed. The system should be attractive according to the clients. The design and the color should make users feel comfortable when using the system instead of flashing useless colors on the screen. The design should also reflect the seriousness of the environment.;LF;vague;also
R765;35;The system should be able to manage all the information incoming from the database and the catalogue.;O;vague;able to
R768;35;The system should need to be entirely self-supporting since the users would be using it only to register courses.;US;vague;only
R770;35;Everyone (stakeholders and guests) can have access to the system and the catalogue. Every client must have secure and private access to his/her data. The  and the service man can have access to every part of the system. All these accesses (except the “guest tour” access) require identification through ID and password.;SE;vague;secure
R774;36;The software system needs a robust security mechanism in place so that unauthorized users are not allowed access to parts of the system.;SE;vague;robust
R779;37;High level of performance requires high speed network and high level of connectivity.;PE;vague;High level
R779;37;High level of performance requires high speed network and high level of connectivity.;PE;vague;high level
R785;38;System will use secured database;SE;vague;secured
R786;38;Normal users can just read information but they cannot edit or modify anything except their personal and some other information.;SE;vague;Normal
R797;38;Can only visit the site without registration.;F;vague;only
R803;38;Responsible for informing administrator when any product item’s stock goes under the minimum level.;F;vague;minimum
R811;40;The system is expected to have reasonable short time response. The voter should be able to login and should be able to get response for his requests in 2-3 seconds.;PE;vague;able to
R814;40;To prevent attacks the system should generate random word and ask the user to enter it correctly for multiple tryings.;SE;vague;random
R814;40;To prevent attacks the system should generate random word and ask the user to enter it correctly for multiple tryings.;SE;vague;correctly
R816;40;The system should be simple to use;LF;vague;simple
R825;42;The font will be larger enough for easy reading.;F;vague;easy
R830;42;The text and time/date of a note that has been entered is displayed starting with most recent.;F;vague;recent
R832;42;A description and time/date of each prescription that has been ordered or given is displayed starting with most recent.;F;vague;recent
R834;43;All login attempts shall be done so in a secure manner.;SE;vague;secure
R837;45;The system shall allow the administrator to install additional distributed location templates.;F;vague;additional
R838;45;The system shall allow the administrator to remove physical locations.;F;vague;physical
R868;45;The web application shall add no more than 5 seconds of perceivable overhead time to any necessary web and database transaction time.;PE;vague;necessary
R878;46;The system shall enable user to add one or more component to the configuration.;F;vague;more
R887;46;The system shall display only 10 matching result on the current screen.;F;vague;only
R896;46;The system shall display the most frequently searched items by the user in the profile.;F;vague;frequently
R941;46;The product shall take initial load time depending on internet connection strength which also depends on the media from which the product is run.;PE;vague;also
R943;46;The system shall use secure sockets in all transactions that include any confidential customer information.;SE;vague;secure
R954;47;The system shall use secure socket layer (SSL) technology to ensure all payments made online and user logins are secure.;SE;vague;secure
R956;48;The system may be throttled or slowed down on heavy loads to ensure service for everybody. By throttling is meant that certain functionality may be unavailable during heavy server load.;PE;vague;certain
R957;48;The application should be able to support 100 concurrent users without any performance degradation.;PE;vague;able to
R958;48;The system should be able to scale up to 500 concurrent users (if there is a need in the future) by installing additional hardware components.;SC;vague;able to
R958;48;The system should be able to scale up to 500 concurrent users (if there is a need in the future) by installing additional hardware components.;SC;vague;there is
R958;48;The system should be able to scale up to 500 concurrent users (if there is a need in the future) by installing additional hardware components.;SC;vague;additional
R960;48;A secure server will be required to ensure confidentiality of customer’s credit card and other details.;SE;vague;secure
R964;48;The system should be easy enough to maintain that someone else could do it with a manual and a few hours training.;MN;vague;easy
R965;48;The system should be portable to various operating environments.;PO;vague;various
R966;49;Registered User must be able to maintain his/her session information for at least 60 minutes of inactive session before the system prompts him to log out of the system. The registered user must be provided with all the options of the E-store regardless of the time when he/she logs in.;F;vague;able to
R966;49;Registered User must be able to maintain his/her session information for at least 60 minutes of inactive session before the system prompts him to log out of the system. The registered user must be provided with all the options of the E-store regardless of the time when he/she logs in.;F;vague;regardless of
R967;49;The entire website must be user-friendly and easily navigable. The website must be provided with a site map for quick access to a particular link according to the requirement specification. The user must be able to find what he/she wants from the site without any difficulty. The website must adhere to branding schemes and the layout of the web pages must be uniform throughout  ;US;vague;able to
R967;49;The entire website must be user-friendly and easily navigable. The website must be provided with a site map for quick access to a particular link according to the requirement specification. The user must be able to find what he/she wants from the site without any difficulty. The website must adhere to branding schemes and the layout of the web pages must be uniform throughout  ;US;vague;easily
R967;49;The entire website must be user-friendly and easily navigable. The website must be provided with a site map for quick access to a particular link according to the requirement specification. The user must be able to find what he/she wants from the site without any difficulty. The website must adhere to branding schemes and the layout of the web pages must be uniform throughout  ;US;vague;particular
R969;49;The website must provide highest degree of security to the registered users. All the transactions that are made must be secured. The sensitive information passed to and from the website must be secured. Identity theft and other security related issues must be solved. Unauthorized transmission of sensitive information of the user to third party websites for reference must be avoided. On the basis of user agreement the information must be processed. All the information about the registered user must be securely stored in the central database.;SE;vague;securely
