ID;ID progetto;REQUISITO (testo);Classe dei requisiti;CATEGORIA;PAROLA
R3;1;If projected  the data must be readable.  On a 10x10 projection screen  90% of viewers must be able to read Event / Activity data from a viewing distance of 30;US;vague;able to
R4;1;The product shall be available during normal business hours. As long as the user has access to the client PC  the system will be available 99% of the time during the first six months of operation.;A;vague;normal
R5;1;If projected  the data must be understandable. On a 10x10 projection screen  90% of viewers must be able to determine that Events or Activities are occuring in current time from a viewing distance of 100;US;vague;able to
R5;1;If projected  the data must be understandable. On a 10x10 projection screen  90% of viewers must be able to determine that Events or Activities are occuring in current time from a viewing distance of 100;US;vague;understandable
R6;1;The product shall ensure that it can only be accessed by authorized users.  The product will be able to distinguish between authorized and unauthorized users in all access attempts;SE;vague;able to
R6;1;The product shall ensure that it can only be accessed by authorized users.  The product will be able to distinguish between authorized and unauthorized users in all access attempts;SE;vague;only
R7;1;The product shall be intuitive and self-explanatory. 90% of new users shall be able to start the display of Events or Activities within 90 minutes of using the product.;US;vague;able to
R8;1;The product shall respond fast to keep up-to-date data in the display.;PE;vague;fast
R15;1;The table side of the display shall be split into 2 regions: sequential and temporal.;F;vague;sequential
R32;2;The product shall have a consistent color scheme and fonts.;LF;vague;consistent
R35;2;The product shall be easy for a realtor to learn.;US;vague;easy
R36;2;The product shall use symbols and words that are naturally understandable by the realtor community.;US;vague;understandable
R49;2;The product shall be able to support multiple remote users;SC;vague;able to
R51;2;The product shall be capable of handling the existing 1000 users. This number is expected to grow 5 times within the next year.;SC;vague;capable of
R53;2;90% of untrained realtors shall be able to install the product on their device without printed instructions;US;vague;able to
R55;2;Only registered realtors shall be able to access the system.;SE;vague;able to
R55;2;Only registered realtors shall be able to access the system.;SE;vague;Only
R59;2;The user shall be able to get driving directions to a selected property;F;vague;able to
R60;2;The user shall be able to download appointments and contact information for clients;F;vague;able to
R63;2;Realtor shall be able to generate a CMA report based on property criteria;F;vague;able to
R64;2;The system shall be able to call the seller or buyer to schedule an appointment;F;vague;able to
R66;2;The realtor shall be able to retrieve a map showing property locations for a specified area;F;vague;able to
R69;3;The system shall be easy to use by the Program Administrators/Nursing Staff Members.;US;vague;easy
R70;3;All of the users shall be able to use the system after one day of training.;US;vague;able to
R74;3;2 out of 3 Program Administrators/Nursing Staff Members shall successfully be able to use the system to manage the scheduling of classes and clinicals.;US;vague;able to
R75;3;The system shall use symbols and words that are naturally understandable by the user community.;US;vague;understandable
R76;3;The verbiage used within the system shall be consistent with Standard English and the terminology of the national Nursing Community.;US;vague;consistent
R77;3;Staff members shall be able to complete a set of tasks in a timely manner.;PE;vague;able to
R77;3;Staff members shall be able to complete a set of tasks in a timely manner.;PE;vague;timely
R78;3;The response time of general student management tasks shall take no longer than 5 seconds and the response time of schedule generation shall take no longer than 30 seconds.;PE;vague;general
R81;3;system shall be able to handle all of the user requests/usage during business hours.;SC;vague;able to
R83;3;The system shall be capable of processing 100% of nursing students and their classes for the next 10 years.;SC;vague;capable of
R85;3;The system shall able to operate within a business office environment typical of the Nursing Department at DePaul University.;O;vague;able to
R91;3;We must be able to interface with any HTML browser.;O;vague;able to
R92;3;Only authorized users shall have access to clinical site information.;SE;vague;Only
R93;3;Program Administrators/Nursing Staff Members are the only people who shall have access to clinical site details.;SE;vague;only
R94;3;Only authorized users shall have access to students\92 personal information.;SE;vague;Only
R95;3;Dr Susan Poslusny and Dr Julie Donalek are the only people who shall have access to students\92 personal information.;SE;vague;only
R96;3;Only authorized users shall have access to the portion of the system that interfaces with CampusConnect.;SE;vague;Only
R97;3;Fit Criterion: Dr Susan Poslusny and Karen Sysol are the only people who shall have access to the final class section scheduling for the system that interfaces with CampusConnect.;SE;vague;only
R100;3;The system shall be built such that it is as secure as possible from malicious interference.;SE;vague;secure
R103;3;Program Administrators and Nursing Staff Members shall be able to add a listing of students to a cohort.;F;vague;able to
R104;3;Program Administrators and Nursing Staff Members shall be able to add a single student to a cohort;F;vague;able to
R106;3;Program Administrators and Nursing Staff Members shall be able to specify the preferred sequence of classes for a given cohort.;F;vague;able to
R107;3;For each class within a sequence for a cohort  Program Administrators and Nursing Staff Members shall be able to specify which quarter that class will be offered.;F;vague;able to
R108;3;Program Administrators and Nursing Staff Members shall be able to add new classes to a sequence of classes;F;vague;able to
R109;3;Program Administrators and Nursing Staff Members shall be able to add clinical classes or sections to a sequence of classes;F;vague;able to
R110;3;Program Administrators and Nursing Staff Members shall be able to add a new cohort to the system  identified by start month and year.;F;vague;able to
R111;3;Program Administrators and Nursing Staff Members shall be able to add new classes for the nursing department into the system.;F;vague;able to
R115;3;Program Administrators/Nursing Staff Members shall be able to create a new Program of Study.;F;vague;able to
R118;3;The system shall be able to display a report of needed classes for a given quarter for all cohorts of all programs for Program Administrators/Nursing Staff Members\92 planning purposes.;F;vague;able to
R121;3;Program Administrators and Nursing Staff Members shall be able to add a new clinical site into the system.;F;vague;able to
R123;3;Program Administrators and Nursing Staff Members shall be able to add a new clinical lab section for an existing clinical class into the System.;F;vague;able to
R125;3;Program Administrators and Nursing Staff Members shall be able to add a student who has registered for a clinical class to a clinical lab section for that class.;F;vague;able to
R128;3;Program Administrators/Nursing Staff Members shall be able to cancel a clinical lab section only if there are no students registered for that clinical lab section.;F;vague;able to
R129;3;A Program Administrator/Nursing Staff Member shall be able to add a new nursing student to the system.;F;vague;able to
R131;3;The system shall be able to display a printable summary for individual cohorts  which will include the students enlisted  the Program of study  sequence of classes  cohort progress through the program  and timeline of completion.;F;vague;able to
R132;3;The system shall be able to display a printable summary for individual clinical sites  which will include information on labs being held at that site for the given quarter (Clinical site  general information on labs held at that location  dates and times of all labs held there).;F;vague;able to
R132;3;The system shall be able to display a printable summary for individual clinical sites  which will include information on labs being held at that site for the given quarter (Clinical site  general information on labs held at that location  dates and times of all labs held there).;F;vague;general
R132;3;The system shall be able to display a printable summary for individual clinical sites  which will include information on labs being held at that site for the given quarter (Clinical site  general information on labs held at that location  dates and times of all labs held there).;F;vague;there
R133;3;The system shall be able to display a printable summary for individual clinical labs  which will include (but not be limited to) class name  class number  lab section  listing of students enrolled  instructor  day(s)  time  and location.;F;vague;able to
R134;3;The system shall be able to display a printable summary for individual nursing students  which will include (but not be limited to) student name  student ID  admission date  classes  credits  GPA  and the cohort that the student is enrolled in.;F;vague;able to
R135;3;The system shall be able to display a printable summary of the system log.;F;vague;able to
R136;3;The system shall contain contact information (e-mail and phone number) for all people relevant to the system  including (but not limited to) staff members  students  lecture instructors  clinical lab instructors  and clinical site administrators.;F;vague;but not limited to
R136;3;The system shall contain contact information (e-mail and phone number) for all people relevant to the system  including (but not limited to) staff members  students  lecture instructors  clinical lab instructors  and clinical site administrators.;F;vague;relevant
R138;3;The system will notify affected parties for routine communication purposes  including but not limited to informing students of upcoming offered classes (timeline) and what their schedule will be/shall be.;F;vague;but not limited to
R138;3;The system will notify affected parties for routine communication purposes  including but not limited to informing students of upcoming offered classes (timeline) and what their schedule will be/shall be.;F;vague;routine
R139;3;The system will notify affected parties when changes occur affecting clinicals  including but not limited to clinical section capacity changes  and clinical section cancellations.;F;vague;but not limited to
R140;3;The system will notify affected parties when changes occur affecting classes  including but not limited to class cancellations  class section detail changes  and changes to class offerings for a given quarter.;F;vague;but not limited to
R141;3;The system will notify affected parties when changes occur affecting cohorts  including but not limited to changes to the sequence for a cohort\92s program of study and changes to a given week\92s schedule (lab cancelled this week due to instructor illness).;F;vague;but not limited to
R142;3;The system will notify affected parties when changes occur affecting specific students  including but not limited to changing a student\92s status from full time to part time and moving a student to a different clinical section.;F;vague;but not limited to
R142;3;The system will notify affected parties when changes occur affecting specific students  including but not limited to changing a student\92s status from full time to part time and moving a student to a different clinical section.;F;vague;specific
R143;3;Program Administrators/Nursing Staff Members shall have the ability to modify information relating to cohorts including cohort identifier  program of study  preferred sequence of classes and quarters that a cohort will be taking specific classes.;F;vague;specific
R150;4;The list of dispute cases that are displayed after a search is performed must be color coded for easy identification of dispute cases based upon the dispute case status.;US;vague;easy
R152;4;100% of cardmember services representatives shall be able to successfully create a dispute case on the first encounter after completing the training course.;US;vague;able to
R153;4;100% of merchant services representatives shall be able to successfully perform a follow up action on a dispute case on the first encounter after completing the training course.;US;vague;able to
R154;4;The maximum wait time for a user navigating from one screen to another within the Disputes application shall be no more than 5 seconds.;PE;vague;maximum
R162;4;The Disputes application shall ensure that only users with the appropriate access level are allowed to initiate dispute requests.;SE;vague;only
R163;4;Only users with Update access must be able to initiate dispute requests.;SE;vague;able to
R163;4;Only users with Update access must be able to initiate dispute requests.;SE;vague;Only
R164;4;The Disputes application shall ensure that only authorized users are allowed to logon to the application.;SE;vague;only
R165;4;All authorized users  once authenticated must be able to logon to the Disputes System;SE;vague;able to
R168;4;If a user account is revoked  it can only be re-instantiated by the System Administrator.;SE;vague;only
R169;4;Only the System Administrator shall be able to reset a revoked user logon account;SE;vague;able to
R169;4;Only the System Administrator shall be able to reset a revoked user logon account;SE;vague;Only
R176;4;The Disputes application must maintain a detailed history of every action that a user takes on a dispute case.  This ensures a complete audit trail if questions arise later on with regard to a particular dispute case.;L;vague;particular
R211;5;The product shall be easy to use by Adjusters and Collision Estimators.  95% of Adjusters and Collision Estimators shall find the product easy to use.;US;vague;easy
R214;5;The product shall be easy to learn by Adjusters and Collision Estimators.  The product shall be learned with two days onsite training;US;vague;easy
R215;5;The user shall easily locate instructions while using the product.  User help can be found within 90% of the system.;US;vague;easily
R220;5;The product shall adhere to the corporate online availability schedule.  The application is brought down only within 98% of the scheduled outages per the availability schedule.;A;vague;only
R222;5;The product shall be able to handle up to 1500 simultaneous users. The system shall perform with 1500 users as a time.;SC;vague;able to
R224;5;The product shall be able to handle 10 000 concurrent users within 2 years of the initial launch.;SC;vague;able to
R225;5;For estimators  the product shall be able to be operated in a repair facility during dirty and noisy conditions.;O;vague;able to
R230;5;Only adjusters can request recycled parts audit reports. No users without an adjuster role shall request recycled parts audits.;SE;vague;Only
R231;5;Only adjusters with a supervisor role can update preferred repair facility ratings. Users without the supervisor role cannot access the repair facility ratings.;SE;vague;Only
R232;5;Only collision estimators shall search for recycled parts.  Users without the collision estimator role shall not have access to the search for recycled parts.;SE;vague;Only
R233;5;Only valid data shall be entered into the system. No invalid data shall be entered into the system.;SE;vague;Only
R234;5;One insurance company shall not be able to view another insurance companys claim data.;SE;vague;able to
R247;5;The adjuster shall be able to override the preferred repair facitlity on the estimate assignment.;F;vague;able to
R281;6;The product\92s Look and Feel shall be able to incorporate aspects of the customer\92s organization such as logo  branding  and identity;LF;vague;able to
R284;6;The product shall be easy to use. 90% of users will be able to successfully reserve a conference room within 5 minutes of product use.;US;vague;able to
R284;6;The product shall be easy to use. 90% of users will be able to successfully reserve a conference room within 5 minutes of product use.;US;vague;easy
R285;6;The product shall give users feedback when necessary. 80% of the users surveyed report that the product accurately confirms their actions.;US;vague;necessary
R288;6;An employee will be able to successfully use the product within a few minutes.  After informally navigating the product for less than 15 minutes  users shall be able to successfully setup meetings and reserve conference rooms.;US;vague;able to
R292;6;The response shall be fast enough to avoid interrupting the user\92s flow of thought.  90% of tasks shall complete within 5 seconds.  98% of tasks shall complete within 8 seconds.;PE;vague;fast
R295;6;The product shall be capable of handling up to 1 000 concurrent requests.  This number will increase to 2 000 by Release 2.  The concurrency capacity must be able to handle peak scheduling times such as early morning and late afternoon hours.;SC;vague;capable of
R295;6;The product shall be capable of handling up to 1 000 concurrent requests.  This number will increase to 2 000 by Release 2.  The concurrency capacity must be able to handle peak scheduling times such as early morning and late afternoon hours.;SC;vague;able to
R296;6;The product shall be able to process 10 000 transactions per hour within two years of its launch.  This number will increase to 20 000 by Release 2.;SC;vague;able to
R299;6;The product must be able to interface with any HTML browser.  The product shall transmit data between the user and the product without problems. The product shall display HTML properly in 80% of all HTML browsers tested (minimum is to test 8 browsers).;O;vague;able to
R300;6;The product must be able to interface with various database management systems. The product shall communicate successfully with the database management system on 100% of all transactions.;O;vague;able to
R300;6;The product must be able to interface with various database management systems. The product shall communicate successfully with the database management system on 100% of all transactions.;O;vague;various
R301;6;The product must be able to interface with various email servers. The product shall be able to send email.;O;vague;able to
R301;6;The product must be able to interface with various email servers. The product shall be able to send email.;O;vague;various
R304;6;The product will be available for licensing as a one-server  two-five servers  or five-or-more servers license.;O;vague;more
R305;6;A new user must be able to be added to the system within 10 minutes. 90% of new users are able to log into the system within 10 minutes.;US;vague;able to
R306;6;The product must be designed using Design Patterns and coding best practices.  90% of maintenance software developers are able to integrate new functionality into the product with 2 working days.;MN;vague;able to
R306;6;The product must be designed using Design Patterns and coding best practices.  90% of maintenance software developers are able to integrate new functionality into the product with 2 working days.;MN;vague;best
R307;6;The product must be highly configurable for use with various database management systems for the end users.  80% of end users are able to integrate new database management systems with the product without changing the product\92s software code.;MN;vague;able to
R307;6;The product must be highly configurable for use with various database management systems for the end users.  80% of end users are able to integrate new database management systems with the product without changing the product\92s software code.;MN;vague;various
R310;6;The customer shall be able to easily integrate new building maps with the product throughout the product\92s lifecycle.  Integration of new maps with the product shall be possible with little to no support from product support staff.;MN;vague;able to
R310;6;The customer shall be able to easily integrate new building maps with the product throughout the product\92s lifecycle.  Integration of new maps with the product shall be possible with little to no support from product support staff.;MN;vague;easily
R311;6;The product shall be translated into foreign languages other than the target market countries\92 languages in future releases.  For each emerging target market  it shall take no more than 5 days to configure the product for that market\92s language.;US;vague;future
R313;6;The product shall be able to be installed in any operating environment within 2 days.;O;vague;able to
R314;6;The product shall ensure that only company employees or external users with company-approved user IDs may have product access.  100% of all logons shall be by either company employees or external users with company-approved user IDs.;SE;vague;only
R315;6;Only managers are able to perform search queries for reservations by user.  100% of all search queries for reservations by user shall be from logons of only management logons.;SE;vague;able to
R315;6;Only managers are able to perform search queries for reservations by user.  100% of all search queries for reservations by user shall be from logons of only management logons.;SE;vague;Only
R315;6;Only managers are able to perform search queries for reservations by user.  100% of all search queries for reservations by user shall be from logons of only management logons.;SE;vague;only
R319;6;The product shall have the ability to receive automatic software updates as new threats emerge. 100% of customers will be able to receive automatic software updates transmitted to the installed product.;SE;vague;able to
R321;6;The product shall be able to display calendar dates and times according to the user\92s locale.  90% of survey respondents from each target market country will find that the date and time formatting of the product is correct.;US;vague;able to
R330;6;The product will be able to delete conference rooms.;F;vague;able to
R331;6;The product shall be able to store new room equipment.;F;vague;able to
R333;6;The product shall be able to delete room equipment.;F;vague;able to
R346;6;The product shall be able to send meeting notifications via different kinds of end-user specified methods.;F;vague;able to
R353;7;The System shall be able to automatically backup business data and restore them on demand.;O;vague;able to
R354;7;The System shall maintain consistent security.  Any changes in user passwords and/or permissions should take affect in all parts of the System.;SE;vague;consistent
R356;7;The System shall meet all applicable accounting standards.  The final version of the System must successfully pass independent audit performed by a certified auditor.;L;vague;applicable
R357;7;The System shall not require additional third party licenses resulting in royalty fees.;O;vague;additional
R359;7;The System shall allow on demand generation of all Inventory Quantity Adjustment documents since certain point of time.;F;vague;certain
R369;7;PME Subsystem shall allow for a product to exist in more than one submenu;F;vague;exist in
R373;8;Administrator shall be able to activate a pre-paid card via the Administration section in under 5 seconds.;PE;vague;able to
R374;8; Customer shall be able to check the status of their prepaid card  by entering in the PIN number  in under 5 seconds.;PE;vague;able to
R378;8;System shall let customers cancel their account  process shall take no longer than 2 minutes.  Database will mark the account as inactive  and user will not be able to log into the website.;PE;vague;able to
R379;8;System shall let administrator de-activate a customer account in under 1 minute. Customer will no longer be able to access the website.;PE;vague;able to
R387;8;The product should be able to be used by 90% of novice users on the Internet.;US;vague;able to
R388;8;Users should only have to navigate through a maximum of 4 pages  to create an account with the website.;US;vague;only
R389;8;Users should be able to access their streaming movies in under 2 clicks after logging into the website.;US;vague;able to
R393;8;The product shall be easy for customers with novice skills on the  Internet to purchase and watch streaming movies.  Customers should be able to purchase and watch a pre-determined movie in under 3 minutes.;US;vague;able to
R393;8;The product shall be easy for customers with novice skills on the  Internet to purchase and watch streaming movies.  Customers should be able to purchase and watch a pre-determined movie in under 3 minutes.;US;vague;easy
R394;8;The product shall use symbols and words that are naturally understandable by users familiar with websites;US;vague;understandable
R396;8;Any interface between a user and the automated system shall have a maximum response time of 5 seconds  unless noted by an exception below.;PE;vague;maximum
R397;8;When purchasing a streaming movie or pre-paid card via credit card  the processing time should have a maximum response time of 15 seconds.;PE;vague;maximum
R399;8;While streaming a movie  buffering should only occur if there is latency in the user\92s connection.;PE;vague;there is
R399;8;While streaming a movie  buffering should only occur if there is latency in the user\92s connection.;PE;vague;only
R400;8;All credit card information will be secured on the server  and only accessible by authorized Izogn administrators.  Information will be encrypted in the database.;SE;vague;only
R407;8;"The streaming server will support a maximum of 700 movies; new servers can be added to support more movies.";SC;vague;more
R409;8;The website shall be capable of supporting 100 000 customers.;SC;vague;capable of
